# Format: DCGM field, Prometheus metric type, help string
# Only fields the GB10 (DGX Spark) actually reports. The DCGM profiling
# (DCGM_FI_PROF_*) fields and framebuffer fields are unsupported on this
# unified-memory iGPU - the exporter logs "metric not enabled" for them.
DCGM_FI_DEV_SM_CLOCK,   gauge, SM clock frequency (MHz)
DCGM_FI_DEV_GPU_TEMP,   gauge, GPU temperature (C)
DCGM_FI_DEV_POWER_USAGE, gauge, Power draw (W)
DCGM_FI_DEV_TOTAL_ENERGY_CONSUMPTION, counter, Total energy consumption since boot (mJ)
DCGM_FI_DEV_GPU_UTIL,      gauge, GPU utilization (%)
DCGM_FI_DEV_MEM_COPY_UTIL, gauge, Memory copy engine utilization (%)
